{"$schema":"https://json-schema.org/draft/2020-12/schema","$id":"https://wiki-spike.local/schemas/second-brain/contract-envelope-v1.schema.json","title":"Signed Second Brain Contract Envelope V1","type":"object","additionalProperties":false,"required":["contract_envelope_version","contract_version","contract_body","contract_digest","signatures"],"$defs":{"signature":{"type":"object","additionalProperties":false,"required":["signature_version","role","key_id","public_key_b64","signature_b64"],"properties":{"signature_version":{"const":"second-brain-contract-signature-v1"},"role":{"enum":["owner","approver"]},"key_id":{"type":"string","minLength":1},"public_key_b64":{"type":"string","minLength":1},"signature_b64":{"type":"string","minLength":1}}},"names":{"type":"array","uniqueItems":true,"items":{"type":"string","minLength":1}},"disabled":{"type":"object","propertyNames":{"type":"string","minLength":1},"additionalProperties":{"type":"string","minLength":1}},"manifest_entry":{"type":"object","additionalProperties":false,"required":["decision_id","scope_kind","scope_name"],"properties":{"decision_id":{"enum":["DB-02","DB-03","DB-06","DB-08"]},"scope_kind":{"enum":["source_profile","migration_source","external_model_route","export_destination"]},"scope_name":{"type":"string","minLength":1}}},"manifest":{"type":"object","additionalProperties":false,"required":["manifest_version","expected_scopes"],"properties":{"manifest_version":{"const":"second-brain-expected-scope-manifest-v1"},"expected_scopes":{"type":"array","uniqueItems":true,"items":{"$ref":"#/$defs/manifest_entry"},"minItems":9}}},"resolved_scope":{"type":"object","additionalProperties":false,"required":["scope_version","enabled_source_profiles","disabled_source_profiles","enabled_migration_sources","disabled_migration_sources","feature_flags","egress_destinations","enabled_external_model_routes","disabled_external_model_routes","disabled_export_destinations","capability_manifest_digest","source_manifest_digest","mandatory_release_constraints"],"properties":{"scope_version":{"const":"second-brain-resolved-scope-v1"},"enabled_source_profiles":{"$ref":"#/$defs/names"},"disabled_source_profiles":{"$ref":"#/$defs/disabled"},"enabled_migration_sources":{"$ref":"#/$defs/names"},"disabled_migration_sources":{"$ref":"#/$defs/disabled"},"feature_flags":{"type":"array","uniqueItems":true,"items":{"enum":["identity-auth","conflict-behavior","benchmark-governance","cutover-retention"]}},"egress_destinations":{"$ref":"#/$defs/names"},"enabled_external_model_routes":{"$ref":"#/$defs/names"},"disabled_external_model_routes":{"$ref":"#/$defs/disabled"},"disabled_export_destinations":{"$ref":"#/$defs/disabled"},"capability_manifest_digest":{"type":"string","pattern":"^[0-9a-f]{64}$"},"source_manifest_digest":{"type":"string","pattern":"^[0-9a-f]{64}$"},"mandatory_release_constraints":{"type":"array","minItems":1,"uniqueItems":true,"items":{"type":"string","minLength":1}}}},"decision_digest":{"type":"object","additionalProperties":false,"required":["decision_id","scope_kind","scope_name","digest"],"properties":{"decision_id":{"enum":["DB-01","DB-02","DB-03","DB-04","DB-05","DB-06","DB-07","DB-08"]},"scope_kind":{"enum":["global","source_profile","migration_source","external_model_route","export_destination"]},"scope_name":{"type":"string"},"digest":{"type":"string","pattern":"^[0-9a-f]{64}$"}}},"contract_body":{"type":"object","additionalProperties":false,"required":["contract_version","decision_digests","resolved_scope","expected_scope_manifest"],"properties":{"contract_version":{"const":"second-brain-contract-digest-v1"},"decision_digests":{"type":"array","uniqueItems":true,"items":{"$ref":"#/$defs/decision_digest"}},"resolved_scope":{"$ref":"#/$defs/resolved_scope"},"expected_scope_manifest":{"$ref":"#/$defs/manifest"}}}},"properties":{"contract_envelope_version":{"const":"second-brain-contract-envelope-v1"},"contract_version":{"const":"second-brain-contract-digest-v1"},"contract_body":{"$ref":"#/$defs/contract_body"},"contract_digest":{"type":"string","pattern":"^[0-9a-f]{64}$"},"signatures":{"type":"array","minItems":2,"maxItems":2,"prefixItems":[{"allOf":[{"$ref":"#/$defs/signature"},{"properties":{"role":{"const":"approver"}}}]},{"allOf":[{"$ref":"#/$defs/signature"},{"properties":{"role":{"const":"owner"}}}]}],"items":false}}}
