{"contract_body":{"contract_version":"second-brain-contract-digest-v1","decision_digests":[{"decision_id":"DB-01","digest":"0519a0ec82677e281b4cd6ba53b6a94c1e75bad95921e3efbdbe8b52e7dfe1fb","scope_kind":"global","scope_name":""},{"decision_id":"DB-02","digest":"ec186a6264b37cd45e294ce538c475ba3fa65f6c92a51e6235f548151acb18bd","scope_kind":"source_profile","scope_name":"Claude/Memory Bank"},{"decision_id":"DB-02","digest":"89d48cc3e4e88c01f8070fe6876f479d386f000c78d85409f1cada54fb87d48f","scope_kind":"source_profile","scope_name":"Codex"},{"decision_id":"DB-02","digest":"df1abdf470fa031042b6018fe0844d029939bd265181571c00d29fe1fcc1ebe3","scope_kind":"source_profile","scope_name":"Git"},{"decision_id":"DB-02","digest":"523280d543b13614e800e5d34d1338f3acd4020434930c3297d66dfbce42b262","scope_kind":"source_profile","scope_name":"Markdown"},{"decision_id":"DB-03","digest":"37e31190cd3d15bc7c41605445168ad349a19e9961d862be156f026eae539574","scope_kind":"migration_source","scope_name":"legacy Mem0/RAG"},{"decision_id":"DB-03","digest":"f5c8dc99361b44bdbb278ed43cb28fb40249fce4c55e50f390c08b2ad48284aa","scope_kind":"migration_source","scope_name":"me-wiki"},{"decision_id":"DB-03","digest":"c788db01ff883c8d29f4a5ad58a8f6ffcee64a817431e8a3e37e5447a5fd2ab6","scope_kind":"migration_source","scope_name":"unified-db"},{"decision_id":"DB-04","digest":"d0b640b9d0678253b6c4392afd6c7c39e89380a08b7863931996303e83c930ef","scope_kind":"global","scope_name":""},{"decision_id":"DB-06","digest":"5692a9da9aad57bf3798c4a20c30f930d09f3f60388b3519c1efe925989d4589","scope_kind":"external_model_route","scope_name":"model-a"},{"decision_id":"DB-07","digest":"727a5cd36c5c3bca9151f4d1b5276ee02b8ed43b324d5e6a5b257165e736cc27","scope_kind":"global","scope_name":""},{"decision_id":"DB-08","digest":"687d09dc5a50233be92ade2865c0197025d0d0bca60e2dd9453ee28fdbd66cdb","scope_kind":"export_destination","scope_name":"archive"}],"expected_scope_manifest":{"expected_scopes":[{"decision_id":"DB-02","scope_kind":"source_profile","scope_name":"Claude/Memory Bank"},{"decision_id":"DB-02","scope_kind":"source_profile","scope_name":"Codex"},{"decision_id":"DB-02","scope_kind":"source_profile","scope_name":"Git"},{"decision_id":"DB-02","scope_kind":"source_profile","scope_name":"Markdown"},{"decision_id":"DB-03","scope_kind":"migration_source","scope_name":"legacy Mem0/RAG"},{"decision_id":"DB-03","scope_kind":"migration_source","scope_name":"me-wiki"},{"decision_id":"DB-03","scope_kind":"migration_source","scope_name":"unified-db"},{"decision_id":"DB-06","scope_kind":"external_model_route","scope_name":"model-a"},{"decision_id":"DB-08","scope_kind":"export_destination","scope_name":"archive"}],"manifest_version":"second-brain-expected-scope-manifest-v1"},"resolved_scope":{"capability_manifest_digest":"944855a53e6bb03d31ce70c02db37c86620a6068a60a3fdd8b3b6f6f6470904c","disabled_export_destinations":{"archive":"signed NO_GO"},"disabled_external_model_routes":{"model-a":"signed NO_GO"},"disabled_migration_sources":{"legacy Mem0/RAG":"signed NO_GO","unified-db":"signed NO_GO"},"disabled_source_profiles":{"Claude/Memory Bank":"signed NO_GO","Codex":"signed NO_GO","Git":"signed NO_GO","Markdown":"signed NO_GO"},"egress_destinations":[],"enabled_external_model_routes":[],"enabled_migration_sources":["me-wiki"],"enabled_source_profiles":[],"feature_flags":["conflict-behavior","cutover-retention","identity-auth"],"mandatory_release_constraints":["signed-release-baseline"],"scope_version":"second-brain-resolved-scope-v1","source_manifest_digest":"71ad9b501a0442b32752dba79aa0e0525812f3ec0f5927ba6038d54046f8d2ad"}},"contract_digest":"4f95a486c586dd5690aa55ec863543a0166ed640219a03b9fdff13fcfc6d559f","contract_envelope_version":"second-brain-contract-envelope-v1","contract_version":"second-brain-contract-digest-v1","signatures":[{"key_id":"wiki-spike-local-approver-2026","public_key_b64":"qqjshbOlaEeE5umj4jBVJPYqOqFypULm4nX9FSxIMNQ=","role":"approver","signature_b64":"MoKWmAJWt4WAN9wS2NtlcXI4UqDLyOwiZaALFsN/r8IcHWkz46CbBhjsNKeb8LkOUx9qJZKwmh2l0ULUsUgeDw==","signature_version":"second-brain-contract-signature-v1"},{"key_id":"wiki-spike-local-owner-2026","public_key_b64":"AqkUcin7vP0DSKNKq77+AoG4dLivjs7gBQC+I2U0znQ=","role":"owner","signature_b64":"yGXKpcec2tv+9nvuRcwH2+sqMg070lGtW203z7uG4UbbRqk2BHhtywSATs4/07DiS3bU4iolvSPxy0Xo+pC7Cw==","signature_version":"second-brain-contract-signature-v1"}]}